{
  "task_id": "PIPE-001",
  "project_id": "PIPE-001",
  "owner": "A01",
  "verifier": "A04",
  "task_type": "infrastructure",
  "objective": "Speed up the studio pipeline with the six changes SHANNON approved on 2026-10-31, and batch SHANNON's approvals into one checkpoint per milestone (CLAUDE.md rule 14, studio/gates.md).",
  "inputs": [
    "Coordinator proposal approved by SHANNON in the project chat, 2026-10-31",
    "CLAUDE.md",
    "studio/gates.md"
  ],
  "dependencies": [],
  "acceptance_criteria": [
    "CLAUDE.md has the read-first order, rules 11 to 14 and the milestone checkpoint section",
    "studio/gates.md lists the new automatic checks per gate and the checkpoint rule; human gates unchanged",
    "PIPE-002, PIPE-003, PIPE-004 and SPIRE-002 are in review with evidence",
    "node tools/validate-tasks.mjs passes"
  ],
  "verification": "QA review of the PR by a thread that did not write it; CI green",
  "output_artifacts": ["CLAUDE.md", "studio/gates.md"],
  "files": ["CLAUDE.md", "studio/gates.md", "README.md"],
  "tests": [],
  "risk_level": "low",
  "status": "in_review",
  "evidence": [],
  "notes": "Umbrella task. Points 1 to 6 of the proposal map to SPIRE-002 (build stamp and publish verification), PIPE-002 (scoped tasks), PIPE-003 (kit and headless tests, points 3 and 4), PIPE-004 (short context files) and this task (point 6, checkpoints)."
}
