{
  "project_id": "GARDEN-001",
  "risk_level": "low",
  "status": "in_review",
  "task_id": "GARDEN-023",
  "owner": "A11",
  "verifier": "A15",
  "task_type": "asset",
  "objective": "Build the 19 Blender creature models creature_<id> to the section 9.1 contract, add them to the manifest, the generated GardenAssets module, the register and the Blender plan.",
  "inputs": [
    "docs/architecture/garden.md §9.1",
    "docs/game-design/game4-gdd.md §U1, §U9",
    "docs/assets/garden-blender-plan.md",
    "tools/blender/garden/README.md"
  ],
  "dependencies": [
    "GARDEN-022"
  ],
  "acceptance_criteria": [
    "manifest.json has 19 creature_<id> entries, one mesh each, origin at the base centre, front on Blender -Y, height 2.8 to 6 studs and x, z within 6 at Normal size, tris within 3000 (GardenAssets.spec.luau pins size and parts to the manifest and checks the height and footprint band)",
    "src/shared/GardenAssets.luau is regenerated by tools/blender/write-assets-module.mjs garden, model ids nil until the Director's upload step runs",
    "docs/assets/register.md has one row per model (studio-owned original work, as the egg rows) before any id is used",
    "docs/assets/garden-blender-plan.md lists the 19 models with their target heights and the lineup preview",
    "No file outside files changes; lune run tests/run GardenAssets passes"
  ],
  "verification": "CI (GardenAssets.spec), A15 looks at the lineup preview against the band and the GDD names",
  "output_artifacts": [
    "src/shared/GardenAssets.luau",
    "docs/assets/garden-blender-plan.md"
  ],
  "evidence": [
    "19 creature_<id> entries in tools/blender/garden/manifest.json, uploaded.json and src/shared/GardenAssets.luau (upload-assets run 41359537619); lune run tests/run 480/480 with GardenAssets.spec green",
    "Studio 2026-11-01, build dev: all 19 models load through Models.night at server start, GetExtentsSize equals the manifest size for every one, and an unrotated placement faces Roblox -Z (the README's unverified Blender -Y front holds; Plots keeps CREATURE_YAW 0). Sizes read right next to each other: commons near 3 to 4 studs, Legendary and Mythic 5 to 6, kirin tallest at 6.25",
    "docs/assets/register.md: 19 creature_<id> model rows in the GARDEN-020 table (added in GARDEN-025's PR, same branch)"
  ],
  "files": [
    "tools/blender/garden/**",
    "assets/garden/**",
    "src/shared/GardenAssets.luau",
    "tests/GardenAssets.spec.luau",
    "docs/assets/register.md",
    "docs/assets/garden-blender-plan.md"
  ],
  "tests": [
    "GardenAssets.spec.luau"
  ],
  "notes": "Two artists share this task; split by species, one PR each is fine as long as each PR regenerates GardenAssets.luau. Code never waits for a model: Models.nightReady keeps the old mesh or the part fallback until an id is uploaded (GARDEN-025 wires the loading)."
}
